{
  "tool": "demo-driver",
  "tool_version": "1.2.0",
  "spec_version": "0.1.0",
  "schema_version": "1.0",
  "capabilities": [
    {
      "id": "document-create-object",
      "command": "document create-object",
      "effects": [
        "change"
      ],
      "modes": [
        "session"
      ],
      "request_schema": "urn:demo-driver:create-object:1.0",
      "result_schema": "urn:tool-driver-cli-spec:response:1.0",
      "maturity": "experimental",
      "environments": [
        {
          "application": "document-editor",
          "application_version": "3.2.0",
          "platform": "windows",
          "arch": "amd64",
          "adapter_version": "1.2.0",
          "mode": "session",
          "limitations": [
            "Synthetic example; no application was run."
          ]
        }
      ],
      "limits": [
        "Single target document per request."
      ],
      "recovery": {
        "atomicity": "none",
        "undo": false,
        "idempotent": false,
        "cancel": false
      },
      "evidence_refs": [],
      "description": "Plan or create one object in an explicitly selected document.",
      "phases": [
        "plan",
        "apply"
      ],
      "parameters": [
        {
          "name": "--target-id",
          "location": "option",
          "binding": "/properties/target_id",
          "required": true,
          "description": "Input field: target_id"
        },
        {
          "name": "--name",
          "location": "option",
          "binding": "/properties/name",
          "required": true,
          "description": "Input field: name"
        },
        {
          "name": "--request-id",
          "location": "option",
          "binding": "/properties/request_id",
          "required": true,
          "description": "Input field: request_id"
        },
        {
          "name": "--authorization-ref",
          "location": "option",
          "binding": "/properties/authorization_ref",
          "required": true,
          "description": "Input field: authorization_ref"
        },
        {
          "name": "--phase",
          "location": "option",
          "binding": "/properties/phase",
          "required": true,
          "description": "Input field: phase"
        }
      ],
      "examples": [
        {
          "argv": [
            "document",
            "create-object",
            "--target-id",
            "doc-a",
            "--name",
            "item-a",
            "--request-id",
            "req-a",
            "--authorization-ref",
            "task-a",
            "--phase",
            "plan"
          ],
          "description": "Synthetic invocation; identifiers require substitution in a real authorized environment.",
          "phase": "plan",
          "request": {
            "target_id": "doc-a",
            "name": "item-a",
            "request_id": "req-a",
            "authorization_ref": "task-a",
            "phase": "plan"
          }
        }
      ],
      "error_codes": [
        "E_VALIDATION",
        "E_CONFLICT",
        "E_OUTCOME_UNKNOWN"
      ]
    }
  ],
  "error_codes": [
    {
      "code": "E_VALIDATION",
      "exit_code": 2,
      "description": "Input rejected before applying changes."
    },
    {
      "code": "E_CONFLICT",
      "exit_code": 6,
      "description": "Target or baseline changed."
    },
    {
      "code": "E_OUTCOME_UNKNOWN",
      "exit_code": 1,
      "description": "Inspect the existing operation; do not blindly repeat it."
    }
  ],
  "schemas": {
    "urn:demo-driver:create-object:1.0": {
      "$schema": "https://json-schema.org/draft/2020-12/schema",
      "$id": "urn:demo-driver:create-object:1.0",
      "type": "object",
      "properties": {
        "target_id": {
          "type": "string",
          "minLength": 1
        },
        "name": {
          "type": "string",
          "minLength": 1
        },
        "request_id": {
          "type": "string",
          "minLength": 1
        },
        "authorization_ref": {
          "type": "string",
          "minLength": 1
        },
        "phase": {
          "enum": [
            "plan",
            "apply"
          ]
        }
      },
      "required": [
        "target_id",
        "name",
        "request_id",
        "authorization_ref",
        "phase"
      ],
      "additionalProperties": false
    },
    "urn:tool-driver-cli-spec:response:1.0": {
      "$schema": "https://json-schema.org/draft/2020-12/schema",
      "$id": "urn:tool-driver-cli-spec:response:1.0",
      "title": "response",
      "type": "object",
      "properties": {
        "ok": {
          "type": "boolean"
        },
        "schema_version": {
          "const": "1.0"
        },
        "request_id": {
          "type": "string",
          "minLength": 1
        },
        "phase": {
          "enum": [
            "observe",
            "plan",
            "apply",
            "submit",
            "status",
            "result",
            "verify"
          ]
        },
        "data": {
          "type": "object",
          "properties": {
            "receipt": {
              "$ref": "urn:tool-driver-cli-spec:receipt:1.0"
            },
            "plan": {
              "$ref": "urn:tool-driver-cli-spec:plan:1.0"
            }
          },
          "additionalProperties": true
        },
        "error": {
          "$ref": "urn:tool-driver-cli-spec:common:1.0#/$defs/error"
        },
        "meta": {
          "type": "object",
          "properties": {
            "duration_ms": {
              "type": "number",
              "minimum": 0
            },
            "notices": {
              "type": "array",
              "items": {
                "type": "string",
                "minLength": 1
              }
            }
          },
          "required": [
            "duration_ms"
          ],
          "additionalProperties": false
        },
        "extensions": {
          "type": "object"
        }
      },
      "required": [
        "ok",
        "schema_version",
        "request_id",
        "phase",
        "meta"
      ],
      "additionalProperties": false,
      "allOf": [
        {
          "if": {
            "properties": {
              "ok": {
                "const": false
              }
            },
            "required": [
              "ok"
            ]
          },
          "then": {
            "required": [
              "error"
            ]
          }
        },
        {
          "if": {
            "properties": {
              "ok": {
                "const": true
              }
            },
            "required": [
              "ok"
            ]
          },
          "then": {
            "required": [
              "data"
            ],
            "not": {
              "required": [
                "error"
              ]
            }
          }
        },
        {
          "if": {
            "properties": {
              "ok": {
                "const": true
              },
              "phase": {
                "enum": [
                  "apply",
                  "result"
                ]
              }
            },
            "required": [
              "ok",
              "phase"
            ]
          },
          "then": {
            "properties": {
              "data": {
                "required": [
                  "receipt"
                ]
              }
            }
          }
        }
      ]
    },
    "urn:tool-driver-cli-spec:common:1.0": {
      "$schema": "https://json-schema.org/draft/2020-12/schema",
      "$id": "urn:tool-driver-cli-spec:common:1.0",
      "$defs": {
        "target": {
          "type": "object",
          "properties": {
            "mode": {
              "enum": [
                "session",
                "file",
                "device"
              ]
            },
            "engine_id": {
              "type": "string",
              "minLength": 1
            },
            "instance_id": {
              "anyOf": [
                {
                  "type": "string",
                  "minLength": 1
                },
                {
                  "type": "null"
                }
              ]
            },
            "object_id": {
              "type": "string",
              "minLength": 1
            },
            "locator": {
              "type": "string",
              "minLength": 1
            },
            "extensions": {
              "type": "object"
            }
          },
          "required": [
            "mode",
            "engine_id",
            "instance_id",
            "object_id",
            "locator"
          ],
          "additionalProperties": false,
          "allOf": [
            {
              "if": {
                "properties": {
                  "mode": {
                    "enum": [
                      "session",
                      "device"
                    ]
                  }
                },
                "required": [
                  "mode"
                ]
              },
              "then": {
                "properties": {
                  "instance_id": {
                    "type": "string",
                    "minLength": 1
                  }
                }
              }
            }
          ]
        },
        "snapshot": {
          "type": "object",
          "properties": {
            "id": {
              "type": "string",
              "minLength": 1
            },
            "source": {
              "enum": [
                "live",
                "disk",
                "mixed",
                "device",
                "trial"
              ]
            },
            "revision": {
              "type": "string",
              "minLength": 1
            },
            "observed_at": {
              "type": "string",
              "format": "date-time"
            },